{
  "code": "P05_GREENHOUSE",
  "id": "P05",
  "name": "LumiFreq",
  "type": "Resonant Illumination",
  "phase": 4,
  "stage": "concept",
  "tracks": [
    "Strategic Partner",
    "Revenue"
  ],
  "version": 2,
  "updatedAt": "2026-09-12",
  "software": {
    "capabilities": [
      {
        "id": "light-recipes",
        "name": "Adaptive light recipe control",
        "api": "/api/greenhouse/status",
        "status": "scaffold",
        "evidence": "Scaffold endpoint (see apps/api-gateway); status per fundability audit"
      }
    ]
  },
  "hardware": {
    "individual": {
      "name": "LumiFreq Community Build",
      "audience": "community builder / maker (build-it-yourself)",
      "mode": "community",
      "unit": "1 unit",
      "bom": [
        {
          "part": "ESP32-DevKitC v4",
          "qty": 1,
          "unitUsd": 15,
          "supplier": "Adafruit",
          "source": "https://www.adafruit.com/product/3269 — $15.00 (2026-09-12)",
          "sourcing": "vendor-list"
        },
        {
          "part": "4-channel LED driver",
          "qty": 1,
          "unitUsd": 9.95,
          "supplier": "Adafruit",
          "source": "https://www.adafruit.com/product/5757 — Mosfetti 4-channel MOSFET driver $9.95 (2026-09-12)",
          "sourcing": "vendor-list"
        },
        {
          "part": "RGBW + far-red LED module",
          "qty": 1,
          "unitUsd": 35,
          "supplier": "LED supplier",
          "source": "commodity — procure at build time (multi-vendor, volatile price)",
          "sourcing": "commodity"
        },
        {
          "part": "PPFD/spectrum sensor",
          "qty": 1,
          "unitUsd": 410,
          "supplier": "Apogee Instruments",
          "source": "https://www.apogeeinstruments.com/sq-500-ss-full-spectrum-quantum-sensor/ — SQ-500-SS full-spectrum quantum (PPFD) sensor $410.00 (2026-09-12)",
          "sourcing": "vendor-list"
        },
        {
          "part": "Breadboard + jumpers",
          "qty": 1,
          "unitUsd": 9.95,
          "supplier": "Adafruit",
          "source": "https://www.adafruit.com/product/3314 — half-size breadboard + 78-piece jumper bundle $9.95 (2026-09-12)",
          "sourcing": "vendor-list"
        }
      ],
      "interfaces": {
        "telemetryTopic": "ecos/P05/{deviceId}/telemetry",
        "controlTopic": "ecos/P05/{deviceId}/control",
        "deviceTypes": [
          "spectral-controller"
        ],
        "sensors": [
          "ppfd",
          "spectrum"
        ],
        "actuators": [
          "channel_uv",
          "channel_blue",
          "channel_red",
          "channel_farred"
        ]
      },
      "power": "12V 3A (~36 W)",
      "powerBudget": "12V 3A (~36 W)",
      "buildHours": 4,
      "sla": null,
      "verification": [
        "firmware scaffold with PROJECT_CODE matches (firmware/scaffolds)",
        "interfaces cross-check against config/hardware-manifests.json (spectral-controller)",
        "telemetry/control topics match ecos/<id>/{deviceId}/{telemetry|control}",
        "community BOM priced with supplier + source (vendor list estimates)",
        "power budget and build hours stated"
      ],
      "status": "verified"
    },
    "enterprise": {
      "name": "LumiFreq Enterprise Deployment",
      "audience": "commercial / municipal / campus",
      "mode": "commercial",
      "unit": "per site",
      "topology": "LED arrays -> zone controller -> gateway -> MQTT",
      "bom": [
        {
          "part": "LED array (4-channel)",
          "qty": 20,
          "unitUsd": 320,
          "supplier": "LED supplier",
          "source": "quote-required — no public list price (RFQ)",
          "sourcing": "quote-required"
        },
        {
          "part": "Spectral sensor",
          "qty": 6,
          "unitUsd": 220,
          "supplier": "Apogee Instruments",
          "source": "quote-required — no public list price (RFQ)",
          "sourcing": "quote-required"
        },
        {
          "part": "Zone controller",
          "qty": 1,
          "unitUsd": 350,
          "supplier": "Industrial supplier",
          "source": "quote-required — no public list price (RFQ)",
          "sourcing": "quote-required"
        },
        {
          "part": "Gateway",
          "qty": 1,
          "unitUsd": 200,
          "supplier": "Industrial supplier",
          "source": "quote-required — no public list price (RFQ)",
          "sourcing": "quote-required"
        }
      ],
      "interfaces": {
        "telemetryTopic": "ecos/P05/{deviceId}/telemetry",
        "controlTopic": "ecos/P05/{deviceId}/control",
        "deviceTypes": [
          "spectral-controller"
        ],
        "sensors": [
          "ppfd",
          "spectrum"
        ],
        "actuators": [
          "channel_uv",
          "channel_blue",
          "channel_red",
          "channel_farred"
        ]
      },
      "power": "~6.5 kW per greenhouse",
      "powerBudget": "~6.5 kW per greenhouse",
      "buildHours": 40,
      "sla": "uptime/performance SLA to be agreed with the operator partner",
      "verification": [
        "firmware scaffold with PROJECT_CODE matches (firmware/scaffolds)",
        "interfaces cross-check against config/hardware-manifests.json (spectral-controller)",
        "telemetry/control topics match ecos/<id>/{deviceId}/{telemetry|control}",
        "enterprise BOM priced with supplier + source (vendor list estimates)",
        "power budget and build hours stated",
        "indicative deployment BOM — EPC/vendor quotes required before procurement"
      ],
      "status": "verified"
    }
  },
  "founding": {
    "status": "not_started",
    "parent": "Overlay 365",
    "division": "Overlay Environmental",
    "ventureName": "LumiFreq",
    "structure": "division",
    "licenses": [],
    "capitalAsk": "to_verify",
    "offtake": null,
    "compliance": [],
    "readiness": {
      "hardwarePilot": false,
      "partnerLoi": false,
      "unitEconomics": false
    }
  },
  "provenance": {
    "verifiedBy": [
      "verify.mjs"
    ],
    "driver": "specify-script",
    "rollbackToken": null,
    "source": "seed.mjs (draft from hardware-manifests.json)"
  }
}
